{
  "schema": "https://neo4j.com/ontology-graph-spec/1.0.0/schema.json",
  "id": "3f8a4c2e-9b1d-4e7a-a5c3-2d8f1b6e9a04",
  "version": 3,
  "name": "movies",
  "description": "Movie domain ontology",
  "nodes": {
    "Actor": {
      "label": "Actor",
      "description": "A person who acts in films",
      "aliases": ["Performer"],
      "properties": {
        "id": { "type": "STRING", "key": true },
        "name": {
          "type": "STRING",
          "mustExist": true,
          "description": "Stage name"
        },
        "status": {
          "type": "STRING",
          "one_of": ["active", "retired"]
        },
        "imdb_id": {
          "type": "STRING",
          "pattern": "^tt[0-9]{7,8}$",
          "unique": true
        }
      },
      "extensions": {
        "neo4j:index": {
          "name": "actor_names",
          "properties": ["name"]
        },
        "ui:display": {
          "color": "#e06209",
          "caption": "name"
        }
      }
    },
    "person-id-field": {
      "reference": "https://example.com/external/Person",
      "label": "Person",
      "properties": {
        "id": { "type": "STRING", "key": true }
      }
    },
    "employee": {
      "labels": {
        "identifier": "Employee",
        "implied": ["Person"],
        "optional": ["Contractor"]
      },
      "properties": {
        "employee_id": { "type": "STRING", "key": true }
      }
    },
    "Movie": {
      "label": "Movie",
      "properties": {
        "id": { "type": "STRING", "key": true },
        "title": { "type": "STRING", "mustExist": true },
        "embedding": {
          "type": "VECTOR<FLOAT>",
          "dimension": 1042,
          "description": "Plot embedding",
          "reference": "https://example.com/external/embedding"
        }
      }
    },
    "Studio": {
      "label": "Studio",
      "properties": {
        "id": { "type": "STRING", "key": true },
        "name": { "type": "STRING", "mustExist": true }
      }
    }
  },
  "relationships": {
    "ACTED_IN": {
      "type": "ACTED_IN",
      "from": { "node": "Actor" },
      "to": { "node": "Movie", "max_count": 1 },
      "description": "Filmography",
      "properties": {
        "roles": { "type": "LIST<STRING>" },
        "mixed_list": { "type": "LIST<ANY>" }
      }
    },
    "PRODUCED_STUDIO": {
      "type": "PRODUCED",
      "from": { "node": "Studio", "count": 2 },
      "to": { "node": "Movie", "min_count": 1, "max_count": 5 }
    },
    "PRODUCED_PERSON": {
      "type": "PRODUCED",
      "from": { "node": "person-id-field" },
      "to": { "node": "Movie", "max_count": 1 },
      "description": "Individual producer credit"
    }
  },
  "extensions": {
    "importer:table": {
      "schema": "https://neo4j.com/ontology-graph-spec/extensions/importer-table/0.1.0/schema.json",
      "name": "actors",
      "source": "sql/postgres",
      "columns": { "actor_id": { "type": "varchar" } }
    },
    "importer:mapping": {
      "kind": "node",
      "node": "Actor",
      "table": "actors",
      "key": ["actor_id"]
    }
  }
}
